<!DOCTYPE traningAndTest SYSTEM "trainingAndTestFormat.dtd">
<traningAndTest>
    <datasets>			
		<!-- POSITIVE -->
		<dataset id = "newEggPositive" details = "Polaridad Positiva de newegg">
			<query>
				SELECT ca.mpcaComment FROM MpcaCommentAddition ca WHERE ca.mpcaAdditionType.addType = 'polarity' AND ca.value = 'POSITIVE'
			</query>
		</dataset>
		
		<dataset id = "5Estrellas" details = "5 estrellas sin newEgg">
			<query maxResults = "1000">
				SELECT ca.mpcaComment FROM MpcaCommentAddition ca WHERE ca.mpcaComment.pageId.pageId != 2 AND ca.mpcaAdditionType.addType = 'rank' AND ca.value = '5.0'
			</query>
		</dataset>
		<!-- NEUTRAL
		<dataset id = "newEggNeutral" details = "Polaridad neutral de newegg">
			<query>
				SELECT ca.mpcaComment FROM MpcaCommentAddition ca WHERE ca.mpcaComment.pageId.pageId = 2 AND ca.mpcaAdditionType.addType = 'polarity' AND ca.value = 'NEUTRAL'
			</query>
		</dataset>
		-->
		<!-- NEGATIVE -->
		<dataset id = "1y2Estrellas" details = "Rank de 1 y 2 estrellas sin newEgg">
			<query maxResults = "1000">
				SELECT ca.mpcaComment FROM MpcaCommentAddition ca WHERE ca.mpcaComment.pageId.pageId != 2 AND ca.mpcaAdditionType.addType = 'rank' AND (ca.value = '1.0' OR ca.value = '2.0')
			</query>
		</dataset>
		
		<dataset id = "newEggNegative" details = "Polaridad Negativa de newegg">
			<query>
				SELECT ca.mpcaComment FROM MpcaCommentAddition ca WHERE ca.mpcaAdditionType.addType = 'polarity' AND ca.value = 'NEGATIVE'
			</query>
		</dataset>
		
		<!-- TEST DATA SETS -->
		
		<dataset id = "5Estrellas - test" details = "5 estrellas">
			<query>
				SELECT ca.mpcaComment FROM MpcaCommentAddition ca WHERE ca.mpcaAdditionType.addType = 'rank' AND ca.value = '5.0'
			</query>
		</dataset>
		<!--
		<dataset id = "3Estrellas - test" details = "Rank de 3 estrellas">
			<query>
				SELECT ca.mpcaComment FROM MpcaCommentAddition ca WHERE ca.mpcaAdditionType.addType = 'rank' AND (ca.value = '3.0')
			</query>
		</dataset>
		-->
		<dataset id = "1y2Estrellas - test" details = "Rank de 1 y 2 estrellas">
			<query>
				SELECT ca.mpcaComment FROM MpcaCommentAddition ca WHERE ca.mpcaAdditionType.addType = 'rank' AND (ca.value = '1.0' OR ca.value = '2.0')
			</query>
		</dataset>
    </datasets>
    <classifiers>
        <classifier id = "lingPipeClassifier2" class = "dataProcessing.sentimentAnalysis.MpcaLingPipeClassifier">
			<category name = "POSITIVE">
				<dataset ref="newEggPositive"/>
				<dataset ref="5Estrellas"/>
            </category>
			<!--
            <category name = "NEUTRAL">
                <dataset ref="newEggNeutral"/>
            </category>
			-->
			<category name = "NEGATIVE">
                <dataset ref="1y2Estrellas"/>
				<dataset ref="newEggNegative"/>
            </category>
        </classifier>
    </classifiers>
    <tests>
        <test>
            <classifier ref = "lingPipeClassifier2"/>
            <expectedCategory name = "POSITIVE">
				<dataset ref="5Estrellas - test"/>
            </expectedCategory>
			<!--
            <expectedCategory name = "NEUTRAL">
                <dataset ref="3Estrellas - test"/>
            </expectedCategory>
			-->
			<expectedCategory name = "NEGATIVE">
                <dataset ref="1y2Estrellas - test"/>
            </expectedCategory>
        </test>
    </tests>
</traningAndTest>
